title,article,link
"Bank RMs, wealth managers don’t thrill India’s new class of millionaires. Who does then?","You are a new crorepati. The startup where you spent a decade just got listed and your wealth is concentrated around the company’s shares. Finally, the time has come for you to manage it, with some professional help. Where would you go? To the traditional wealth managers sitting in their swanky offices giving advice in exchange for high commissions, with high reliance on portfolio management services (PMS) that focuses on mutual funds, stocks,",https://economictimes.indiatimes.com/prime/fintech-and-bfsi/bank-rms-wealth-managers-dont-thrill-indias-new-class-of-millionaires-who-does-then/primearticleshow/114194855.cms?source=homepage&medium=prime_exclusives_content&campaign=prime_discovery
McDonald’s India serves a comeback in Q1 FY25 after 3 quarters of losses,"The first quarter of this financial year brought trying times for the restaurant business in India. A combined effect of general elections, inflation, and job cuts has left most restaurants empty. Consumers who continue to eat out are opting for takeouts rather than dining in, according to the new National Restaurant Association of India report. The overall sentiment of the restaurant business has not been the best this quarter. However,",https://economictimes.indiatimes.com/prime/consumer/mcdonalds-india-serves-a-comeback-in-q1-fy25-after-three-quarters-of-losses/primearticleshow/114211143.cms?source=homepage&medium=prime_exclusives_content&campaign=prime_discovery
"Smooth flight or turbulence? What IndiGo, SpiceJet Q2 results are expected to land.","Over the coming few weeks, India’s airlines are expected to announce their second-quarter results, traditionally marked by subdued travel. IndiGo, India’s largest airline by market share, and SpiceJet, the country’s oldest private airline, are expected to post small profits or small losses, according to analysts. In the same quarter last year, IndiGo reported profits of INR189 crore while SpiceJet logged losses of INR449 crore. “Demand is",https://economictimes.indiatimes.com/prime/transportation/smooth-flight-or-turbulence-what-indigo-spicejet-q2-results-are-expected-to-land-/primearticleshow/114194745.cms?source=homepage&medium=prime_exclusives_content&campaign=prime_discovery
Stock picks of the week: 5 stocks with consistent score improvement and upside potential of up to 33%,"The market reaction to some of the initial Q2 numbers suggests it is likely to stay under the control of the bulls. The only caveat: There shouldn’t be trouble emanating from the global markets, that too any readjustment of China weight. Also, even as the overall trend stays bullish, some rotational profit-booking may continue in the near term as more Q2 numbers roll in. Given that valuations are high, it would be better to stay with select",https://economictimes.indiatimes.com/markets/stocks/news/stock-picks-of-the-week-5-stocks-with-consistent-score-improvement-and-upside-potential-of-up-to-33/articleshow/114208175.cms?source=homepage&medium=investment_ideas_content&campaign=prime_discovery
"PSU bank stocks: Stay bullish, avoid narrative trap. 7 PSU banks with upside potential of 31 to 43%","Do a Google search for “PSU bank in the US”. It throws up just one result. Now do a similar search for “private sector banks in China”. A long list appears. Both results are surprising. In a country like China, where how much time kids watch TV is controlled by the government, there is hardly anything that is in reality owned by the private sector. And in the US, where even healthcare is run by private players, can there be a PSU bank in the",https://economictimes.indiatimes.com/markets/stocks/news/psu-bank-stocks-stay-bullish-avoid-narrative-trap-7-psu-banks-with-upside-potential-of-31-to-43/articleshow/114199664.cms?source=homepage&medium=investment_ideas_content&campaign=prime_discovery
Top Nifty50 stocks analysts suggest buying in this volatile week,"The following list of stocks in the headline index Nifty50 were given “Strong Buy/Buy” recommendations in the latest Stock Reports Plus report dated October 14, 2024. Analysts’ recommendations are provided using Institutional Brokers' Estimate System (IBES) to give you actionable insights. You can also check the breakdown of the count of analysts’ giving buy/sell/hold recommendations to each stock in the index.Stock Reports Plus, powered by",https://economictimes.indiatimes.com/markets/stocks/news/top-nifty50-stocks-analysts-suggest-buying-in-this-volatile-week/articleshow/114203401.cms?source=homepage&medium=investment_ideas_content&campaign=prime_discovery
